{
  "$schema": "../schema/model.schema.json",
  "provider": {
    "id": "gitlab",
    "name": "GitLab Duo"
  },
  "models": [
    {
      "id": "duo-chat-opus-4-5",
      "name": "Agentic Chat (Claude Opus 4.5)",
      "family": "claude-opus",
      "tier": "max",
      "capabilities": {
        "vision": false,
        "tools": true,
        "streaming": true,
        "json_mode": true,
        "function_calling": true,
        "reasoning": false
      },
      "pricing": {
        "input": 0,
        "output": 0,
        "cache_read": 0,
        "cache_write": 0,
        "currency": "USD"
      },
      "limits": {
        "context": 200000,
        "max_output": 4096
      },
      "status": "active",
      "release_date": "2026-01-08",
      "is_latest": false
    },
    {
      "id": "duo-chat-sonnet-4-5",
      "name": "Agentic Chat (Claude Sonnet 4.5)",
      "family": "claude-sonnet",
      "tier": "pro",
      "capabilities": {
        "vision": false,
        "tools": true,
        "streaming": true,
        "json_mode": true,
        "function_calling": true,
        "reasoning": false
      },
      "pricing": {
        "input": 0,
        "output": 0,
        "cache_read": 0,
        "cache_write": 0,
        "currency": "USD"
      },
      "limits": {
        "context": 200000,
        "max_output": 4096
      },
      "status": "active",
      "release_date": "2026-01-08",
      "is_latest": false
    },
    {
      "id": "duo-chat-haiku-4-5",
      "name": "Agentic Chat (Claude Haiku 4.5)",
      "family": "claude-haiku",
      "tier": "mini",
      "capabilities": {
        "vision": false,
        "tools": true,
        "streaming": true,
        "json_mode": true,
        "function_calling": true,
        "reasoning": false
      },
      "pricing": {
        "input": 0,
        "output": 0,
        "cache_read": 0,
        "cache_write": 0,
        "currency": "USD"
      },
      "limits": {
        "context": 200000,
        "max_output": 4096
      },
      "status": "active",
      "release_date": "2026-01-08",
      "is_latest": false
    }
  ],
  "updated_at": "2026-01-14T01:40:33.470Z",
  "source": "models.dev"
}
