{
  "$schema": "../schema/model.schema.json",
  "provider": {
    "id": "upstage",
    "name": "Upstage"
  },
  "models": [
    {
      "id": "solar-pro3",
      "name": "solar-pro3",
      "family": "solar-pro",
      "tier": "max",
      "capabilities": {
        "vision": false,
        "tools": true,
        "streaming": true,
        "json_mode": true,
        "function_calling": true,
        "reasoning": true
      },
      "pricing": {
        "input": 0.25,
        "output": 0.25,
        "currency": "USD"
      },
      "limits": {
        "context": 131072,
        "max_output": 8192
      },
      "status": "active",
      "release_date": "2026-01",
      "is_latest": false
    },
    {
      "id": "solar-pro2",
      "name": "solar-pro2",
      "family": "solar-pro",
      "tier": "pro",
      "capabilities": {
        "vision": false,
        "tools": true,
        "streaming": true,
        "json_mode": true,
        "function_calling": true,
        "reasoning": true
      },
      "pricing": {
        "input": 0.25,
        "output": 0.25,
        "currency": "USD"
      },
      "limits": {
        "context": 65536,
        "max_output": 8192
      },
      "status": "active",
      "release_date": "2025-05-20",
      "is_latest": false
    },
    {
      "id": "solar-mini",
      "name": "solar-mini",
      "family": "solar-mini",
      "tier": "mini",
      "capabilities": {
        "vision": false,
        "tools": true,
        "streaming": true,
        "json_mode": true,
        "function_calling": true,
        "reasoning": false
      },
      "pricing": {
        "input": 0.15,
        "output": 0.15,
        "currency": "USD"
      },
      "limits": {
        "context": 32768,
        "max_output": 4096
      },
      "status": "active",
      "release_date": "2024-06-12",
      "is_latest": false
    }
  ],
  "updated_at": "2026-01-14T01:40:33.416Z",
  "source": "models.dev"
}
