{
  "$schema": "../schema/model.schema.json",
  "provider": {
    "id": "vivgrid",
    "name": "Vivgrid"
  },
  "models": [
    {
      "id": "gpt-5.1-codex",
      "name": "GPT-5.1 Codex",
      "family": "gpt-5-codex",
      "tier": "pro",
      "capabilities": {
        "vision": true,
        "tools": true,
        "streaming": true,
        "json_mode": true,
        "function_calling": true,
        "reasoning": true
      },
      "pricing": {
        "input": 1.25,
        "output": 10,
        "cache_read": 0.125,
        "currency": "USD"
      },
      "limits": {
        "context": 400000,
        "max_output": 128000
      },
      "status": "active",
      "release_date": "2025-11-13",
      "is_latest": false
    }
  ],
  "updated_at": "2026-01-13T01:24:27.476Z",
  "source": "models.dev"
}
