{
  "$schema": "../schema/model.schema.json",
  "provider": {
    "id": "privatemode-ai",
    "name": "Privatemode AI"
  },
  "models": [
    {
      "id": "gpt-oss-120b",
      "name": "gpt-oss-120b",
      "family": "gpt-oss",
      "tier": "pro",
      "capabilities": {
        "vision": false,
        "tools": true,
        "streaming": true,
        "json_mode": true,
        "function_calling": true,
        "reasoning": true
      },
      "pricing": {
        "input": 0,
        "output": 0,
        "currency": "USD"
      },
      "limits": {
        "context": 128000,
        "max_output": 128000
      },
      "status": "active",
      "release_date": "2025-08-04",
      "is_latest": false
    },
    {
      "id": "qwen3-embedding-4b",
      "name": "Qwen3-Embedding 4B",
      "family": "qwen3-embedding",
      "tier": "pro",
      "capabilities": {
        "vision": false,
        "tools": false,
        "streaming": true,
        "json_mode": true,
        "function_calling": false,
        "reasoning": false
      },
      "pricing": {
        "input": 0,
        "output": 0,
        "currency": "USD"
      },
      "limits": {
        "context": 32000,
        "max_output": 2560
      },
      "status": "active",
      "release_date": "2025-06-06",
      "is_latest": false
    },
    {
      "id": "qwen3-coder-30b-a3b",
      "name": "Qwen3-Coder 30B-A3B",
      "family": "qwen3-coder",
      "tier": "pro",
      "capabilities": {
        "vision": false,
        "tools": true,
        "streaming": true,
        "json_mode": true,
        "function_calling": true,
        "reasoning": false
      },
      "pricing": {
        "input": 0,
        "output": 0,
        "currency": "USD"
      },
      "limits": {
        "context": 128000,
        "max_output": 32768
      },
      "status": "active",
      "release_date": "2025-04",
      "is_latest": false
    },
    {
      "id": "gemma-3-27b",
      "name": "Gemma 3 27B",
      "family": "gemma-3",
      "tier": "pro",
      "capabilities": {
        "vision": true,
        "tools": true,
        "streaming": true,
        "json_mode": true,
        "function_calling": true,
        "reasoning": false
      },
      "pricing": {
        "input": 0,
        "output": 0,
        "currency": "USD"
      },
      "limits": {
        "context": 128000,
        "max_output": 8192
      },
      "status": "active",
      "release_date": "2025-03-12",
      "is_latest": false
    },
    {
      "id": "whisper-large-v3",
      "name": "Whisper large-v3",
      "family": "whisper",
      "tier": "pro",
      "capabilities": {
        "vision": true,
        "tools": false,
        "streaming": true,
        "json_mode": true,
        "function_calling": false,
        "reasoning": false
      },
      "pricing": {
        "input": 0,
        "output": 0,
        "currency": "USD"
      },
      "limits": {
        "context": 0,
        "max_output": 4096
      },
      "status": "active",
      "release_date": "2023-09-01",
      "is_latest": false
    }
  ],
  "updated_at": "2026-01-14T01:40:33.403Z",
  "source": "models.dev"
}
