{
  "$schema": "../schema/model.schema.json",
  "provider": {
    "id": "firmware",
    "name": "Firmware"
  },
  "models": [
    {
      "id": "google/gemini-3-flash-preview",
      "name": "Gemini 3 Flash Preview",
      "family": "gemini-flash",
      "tier": "mini",
      "capabilities": {
        "vision": true,
        "tools": true,
        "streaming": true,
        "json_mode": true,
        "function_calling": true,
        "reasoning": true
      },
      "pricing": {
        "input": 0,
        "output": 0,
        "currency": "USD"
      },
      "limits": {
        "context": 1048576,
        "max_output": 65536
      },
      "status": "active",
      "release_date": "2025-12-17",
      "is_latest": false
    },
    {
      "id": "openai/gpt-5.2",
      "name": "GPT-5.2",
      "family": "gpt-5",
      "tier": "pro",
      "capabilities": {
        "vision": true,
        "tools": true,
        "streaming": true,
        "json_mode": true,
        "function_calling": true,
        "reasoning": true
      },
      "pricing": {
        "input": 0,
        "output": 0,
        "currency": "USD"
      },
      "limits": {
        "context": 400000,
        "max_output": 128000
      },
      "status": "active",
      "release_date": "2025-12-11",
      "is_latest": false
    },
    {
      "id": "anthropic/claude-opus-4-5",
      "name": "Claude Opus 4.5 (latest)",
      "family": "claude-opus",
      "tier": "max",
      "capabilities": {
        "vision": true,
        "tools": true,
        "streaming": true,
        "json_mode": true,
        "function_calling": true,
        "reasoning": true
      },
      "pricing": {
        "input": 0,
        "output": 0,
        "currency": "USD"
      },
      "limits": {
        "context": 200000,
        "max_output": 64000
      },
      "status": "active",
      "release_date": "2025-11-24",
      "is_latest": false
    },
    {
      "id": "google/gemini-3-pro-preview",
      "name": "Gemini 3 Pro Preview",
      "family": "gemini-pro",
      "tier": "mini",
      "capabilities": {
        "vision": true,
        "tools": true,
        "streaming": true,
        "json_mode": true,
        "function_calling": true,
        "reasoning": true
      },
      "pricing": {
        "input": 0,
        "output": 0,
        "currency": "USD"
      },
      "limits": {
        "context": 1000000,
        "max_output": 64000
      },
      "status": "active",
      "release_date": "2025-11-18",
      "is_latest": false
    },
    {
      "id": "anthropic/claude-haiku-4-5-20251001",
      "name": "Claude Haiku 4.5",
      "family": "claude-haiku",
      "tier": "mini",
      "capabilities": {
        "vision": true,
        "tools": true,
        "streaming": true,
        "json_mode": true,
        "function_calling": true,
        "reasoning": true
      },
      "pricing": {
        "input": 0,
        "output": 0,
        "currency": "USD"
      },
      "limits": {
        "context": 200000,
        "max_output": 64000
      },
      "status": "active",
      "release_date": "2025-10-15",
      "is_latest": false
    },
    {
      "id": "anthropic/claude-sonnet-4-5-20250929",
      "name": "Claude Sonnet 4.5",
      "family": "claude-sonnet",
      "tier": "pro",
      "capabilities": {
        "vision": true,
        "tools": true,
        "streaming": true,
        "json_mode": true,
        "function_calling": true,
        "reasoning": true
      },
      "pricing": {
        "input": 0,
        "output": 0,
        "currency": "USD"
      },
      "limits": {
        "context": 200000,
        "max_output": 64000
      },
      "status": "active",
      "release_date": "2025-09-29",
      "is_latest": false
    },
    {
      "id": "xai/grok-4-fast-non-reasoning",
      "name": "Grok 4 Fast (Non-Reasoning)",
      "family": "grok",
      "tier": "pro",
      "capabilities": {
        "vision": true,
        "tools": true,
        "streaming": true,
        "json_mode": true,
        "function_calling": true,
        "reasoning": false
      },
      "pricing": {
        "input": 0,
        "output": 0,
        "currency": "USD"
      },
      "limits": {
        "context": 2000000,
        "max_output": 30000
      },
      "status": "active",
      "release_date": "2025-09-19",
      "is_latest": false
    },
    {
      "id": "xai/grok-4-fast-reasoning",
      "name": "Grok 4 Fast (Reasoning)",
      "family": "grok",
      "tier": "pro",
      "capabilities": {
        "vision": true,
        "tools": true,
        "streaming": true,
        "json_mode": true,
        "function_calling": true,
        "reasoning": true
      },
      "pricing": {
        "input": 0,
        "output": 0,
        "currency": "USD"
      },
      "limits": {
        "context": 2000000,
        "max_output": 30000
      },
      "status": "active",
      "release_date": "2025-09-19",
      "is_latest": false
    },
    {
      "id": "xai/grok-code-fast-1",
      "name": "Grok Code Fast 1",
      "family": "grok",
      "tier": "pro",
      "capabilities": {
        "vision": false,
        "tools": true,
        "streaming": true,
        "json_mode": true,
        "function_calling": true,
        "reasoning": true
      },
      "pricing": {
        "input": 0,
        "output": 0,
        "currency": "USD"
      },
      "limits": {
        "context": 256000,
        "max_output": 10000
      },
      "status": "active",
      "release_date": "2025-08-28",
      "is_latest": false
    },
    {
      "id": "openai/gpt-5",
      "name": "GPT-5",
      "family": "gpt-5",
      "tier": "pro",
      "capabilities": {
        "vision": true,
        "tools": true,
        "streaming": true,
        "json_mode": true,
        "function_calling": true,
        "reasoning": true
      },
      "pricing": {
        "input": 0,
        "output": 0,
        "currency": "USD"
      },
      "limits": {
        "context": 400000,
        "max_output": 128000
      },
      "status": "active",
      "release_date": "2025-08-07",
      "is_latest": false
    },
    {
      "id": "google/gemini-2.5-flash",
      "name": "Gemini 2.5 Flash",
      "family": "gemini-flash",
      "tier": "mini",
      "capabilities": {
        "vision": true,
        "tools": true,
        "streaming": true,
        "json_mode": true,
        "function_calling": true,
        "reasoning": true
      },
      "pricing": {
        "input": 0,
        "output": 0,
        "currency": "USD"
      },
      "limits": {
        "context": 1048576,
        "max_output": 65536
      },
      "status": "active",
      "release_date": "2025-07-17",
      "is_latest": false
    },
    {
      "id": "google/gemini-2.5-pro",
      "name": "Gemini 2.5 Pro",
      "family": "gemini-pro",
      "tier": "max",
      "capabilities": {
        "vision": true,
        "tools": true,
        "streaming": true,
        "json_mode": true,
        "function_calling": true,
        "reasoning": true
      },
      "pricing": {
        "input": 0,
        "output": 0,
        "currency": "USD"
      },
      "limits": {
        "context": 1048576,
        "max_output": 65536
      },
      "status": "active",
      "release_date": "2025-03-20",
      "is_latest": false
    },
    {
      "id": "deepseek/deepseek-reasoner",
      "name": "DeepSeek Reasoner",
      "family": "deepseek",
      "tier": "pro",
      "capabilities": {
        "vision": true,
        "tools": true,
        "streaming": true,
        "json_mode": true,
        "function_calling": true,
        "reasoning": true
      },
      "pricing": {
        "input": 0,
        "output": 0,
        "currency": "USD"
      },
      "limits": {
        "context": 128000,
        "max_output": 65536
      },
      "status": "active",
      "release_date": "2025-01-20",
      "is_latest": false
    },
    {
      "id": "deepseek/deepseek-chat",
      "name": "DeepSeek Chat",
      "family": "deepseek-chat",
      "tier": "pro",
      "capabilities": {
        "vision": true,
        "tools": true,
        "streaming": true,
        "json_mode": true,
        "function_calling": true,
        "reasoning": false
      },
      "pricing": {
        "input": 0,
        "output": 0,
        "currency": "USD"
      },
      "limits": {
        "context": 128000,
        "max_output": 8192
      },
      "status": "active",
      "release_date": "2024-12-26",
      "is_latest": false
    },
    {
      "id": "openai/gpt-4o",
      "name": "GPT-4o",
      "family": "gpt-4o",
      "tier": "max",
      "capabilities": {
        "vision": true,
        "tools": true,
        "streaming": true,
        "json_mode": true,
        "function_calling": true,
        "reasoning": false
      },
      "pricing": {
        "input": 0,
        "output": 0,
        "currency": "USD"
      },
      "limits": {
        "context": 128000,
        "max_output": 16384
      },
      "status": "active",
      "release_date": "2024-05-13",
      "is_latest": false
    },
    {
      "id": "deepseek/deepseek-coder",
      "name": "DeepSeek Coder",
      "family": "deepseek-coder",
      "tier": "pro",
      "capabilities": {
        "vision": false,
        "tools": true,
        "streaming": true,
        "json_mode": true,
        "function_calling": true,
        "reasoning": false
      },
      "pricing": {
        "input": 0,
        "output": 0,
        "currency": "USD"
      },
      "limits": {
        "context": 16384,
        "max_output": 8192
      },
      "status": "active",
      "release_date": "2024-01-25",
      "is_latest": false
    }
  ],
  "updated_at": "2026-01-13T01:24:27.456Z",
  "source": "models.dev"
}
