{
  "$schema": "../schema/model.schema.json",
  "provider": {
    "id": "huggingface",
    "name": "Hugging Face"
  },
  "models": [
    {
      "id": "MiniMaxAI/MiniMax-M2.1",
      "name": "MiniMax-M2.1",
      "family": "minimax",
      "tier": "mini",
      "capabilities": {
        "vision": false,
        "tools": true,
        "streaming": true,
        "json_mode": true,
        "function_calling": true,
        "reasoning": true
      },
      "pricing": {
        "input": 0.3,
        "output": 1.2,
        "currency": "USD"
      },
      "limits": {
        "context": 204800,
        "max_output": 131072
      },
      "status": "active",
      "release_date": "2025-12-23",
      "is_latest": false
    },
    {
      "id": "zai-org/GLM-4.7",
      "name": "GLM-4.7",
      "family": "glm-4.7",
      "tier": "pro",
      "capabilities": {
        "vision": false,
        "tools": true,
        "streaming": true,
        "json_mode": true,
        "function_calling": true,
        "reasoning": true
      },
      "pricing": {
        "input": 0.6,
        "output": 2.2,
        "cache_read": 0.11,
        "currency": "USD"
      },
      "limits": {
        "context": 204800,
        "max_output": 131072
      },
      "status": "active",
      "release_date": "2025-12-22",
      "is_latest": false
    },
    {
      "id": "XiaomiMiMo/MiMo-V2-Flash",
      "name": "MiMo-V2-Flash",
      "family": "mimo",
      "tier": "mini",
      "capabilities": {
        "vision": false,
        "tools": true,
        "streaming": true,
        "json_mode": true,
        "function_calling": true,
        "reasoning": true
      },
      "pricing": {
        "input": 0.1,
        "output": 0.3,
        "currency": "USD"
      },
      "limits": {
        "context": 262144,
        "max_output": 4096
      },
      "status": "active",
      "release_date": "2025-12-16",
      "is_latest": false
    },
    {
      "id": "deepseek-ai/DeepSeek-V3.2",
      "name": "DeepSeek-V3.2",
      "family": "deepseek-v3",
      "tier": "max",
      "capabilities": {
        "vision": false,
        "tools": true,
        "streaming": true,
        "json_mode": true,
        "function_calling": true,
        "reasoning": true
      },
      "pricing": {
        "input": 0.28,
        "output": 0.4,
        "currency": "USD"
      },
      "limits": {
        "context": 163840,
        "max_output": 65536
      },
      "status": "active",
      "release_date": "2025-12-01",
      "is_latest": false
    },
    {
      "id": "moonshotai/Kimi-K2-Thinking",
      "name": "Kimi-K2-Thinking",
      "family": "kimi-k2",
      "tier": "pro",
      "capabilities": {
        "vision": false,
        "tools": true,
        "streaming": true,
        "json_mode": true,
        "function_calling": true,
        "reasoning": true
      },
      "pricing": {
        "input": 0.6,
        "output": 2.5,
        "cache_read": 0.15,
        "currency": "USD"
      },
      "limits": {
        "context": 262144,
        "max_output": 262144
      },
      "status": "active",
      "release_date": "2025-11-06",
      "is_latest": false
    },
    {
      "id": "Qwen/Qwen3-Next-80B-A3B-Instruct",
      "name": "Qwen3-Next-80B-A3B-Instruct",
      "family": "qwen3",
      "tier": "pro",
      "capabilities": {
        "vision": false,
        "tools": true,
        "streaming": true,
        "json_mode": true,
        "function_calling": true,
        "reasoning": false
      },
      "pricing": {
        "input": 0.25,
        "output": 1,
        "currency": "USD"
      },
      "limits": {
        "context": 262144,
        "max_output": 66536
      },
      "status": "active",
      "release_date": "2025-09-11",
      "is_latest": false
    },
    {
      "id": "Qwen/Qwen3-Next-80B-A3B-Thinking",
      "name": "Qwen3-Next-80B-A3B-Thinking",
      "family": "qwen3",
      "tier": "pro",
      "capabilities": {
        "vision": false,
        "tools": true,
        "streaming": true,
        "json_mode": true,
        "function_calling": true,
        "reasoning": false
      },
      "pricing": {
        "input": 0.3,
        "output": 2,
        "currency": "USD"
      },
      "limits": {
        "context": 262144,
        "max_output": 131072
      },
      "status": "active",
      "release_date": "2025-09-11",
      "is_latest": false
    },
    {
      "id": "moonshotai/Kimi-K2-Instruct-0905",
      "name": "Kimi-K2-Instruct-0905",
      "family": "kimi-k2",
      "tier": "pro",
      "capabilities": {
        "vision": false,
        "tools": true,
        "streaming": true,
        "json_mode": true,
        "function_calling": true,
        "reasoning": false
      },
      "pricing": {
        "input": 1,
        "output": 3,
        "currency": "USD"
      },
      "limits": {
        "context": 262144,
        "max_output": 16384
      },
      "status": "active",
      "release_date": "2025-09-04",
      "is_latest": false
    },
    {
      "id": "Qwen/Qwen3-235B-A22B-Thinking-2507",
      "name": "Qwen3-235B-A22B-Thinking-2507",
      "family": "qwen3",
      "tier": "pro",
      "capabilities": {
        "vision": false,
        "tools": true,
        "streaming": true,
        "json_mode": true,
        "function_calling": true,
        "reasoning": true
      },
      "pricing": {
        "input": 0.3,
        "output": 3,
        "currency": "USD"
      },
      "limits": {
        "context": 262144,
        "max_output": 131072
      },
      "status": "active",
      "release_date": "2025-07-25",
      "is_latest": false
    },
    {
      "id": "Qwen/Qwen3-Coder-480B-A35B-Instruct",
      "name": "Qwen3-Coder-480B-A35B-Instruct",
      "family": "qwen3-coder",
      "tier": "pro",
      "capabilities": {
        "vision": false,
        "tools": true,
        "streaming": true,
        "json_mode": true,
        "function_calling": true,
        "reasoning": false
      },
      "pricing": {
        "input": 2,
        "output": 2,
        "currency": "USD"
      },
      "limits": {
        "context": 262144,
        "max_output": 66536
      },
      "status": "active",
      "release_date": "2025-07-23",
      "is_latest": false
    },
    {
      "id": "moonshotai/Kimi-K2-Instruct",
      "name": "Kimi-K2-Instruct",
      "family": "kimi-k2",
      "tier": "pro",
      "capabilities": {
        "vision": false,
        "tools": true,
        "streaming": true,
        "json_mode": true,
        "function_calling": true,
        "reasoning": false
      },
      "pricing": {
        "input": 1,
        "output": 3,
        "currency": "USD"
      },
      "limits": {
        "context": 131072,
        "max_output": 16384
      },
      "status": "active",
      "release_date": "2025-07-14",
      "is_latest": false
    },
    {
      "id": "deepseek-ai/DeepSeek-R1-0528",
      "name": "DeepSeek-R1-0528",
      "family": "deepseek-r1",
      "tier": "pro",
      "capabilities": {
        "vision": false,
        "tools": true,
        "streaming": true,
        "json_mode": true,
        "function_calling": true,
        "reasoning": true
      },
      "pricing": {
        "input": 3,
        "output": 5,
        "currency": "USD"
      },
      "limits": {
        "context": 163840,
        "max_output": 163840
      },
      "status": "active",
      "release_date": "2025-05-28",
      "is_latest": false
    },
    {
      "id": "Qwen/Qwen3-Embedding-8B",
      "name": "Qwen 3 Embedding 8B",
      "family": "qwen3",
      "tier": "pro",
      "capabilities": {
        "vision": false,
        "tools": false,
        "streaming": true,
        "json_mode": true,
        "function_calling": false,
        "reasoning": false
      },
      "pricing": {
        "input": 0.01,
        "output": 0,
        "currency": "USD"
      },
      "limits": {
        "context": 32000,
        "max_output": 4096
      },
      "status": "active",
      "release_date": "2025-01-01",
      "is_latest": false
    },
    {
      "id": "Qwen/Qwen3-Embedding-4B",
      "name": "Qwen 3 Embedding 4B",
      "family": "qwen3",
      "tier": "pro",
      "capabilities": {
        "vision": false,
        "tools": false,
        "streaming": true,
        "json_mode": true,
        "function_calling": false,
        "reasoning": false
      },
      "pricing": {
        "input": 0.01,
        "output": 0,
        "currency": "USD"
      },
      "limits": {
        "context": 32000,
        "max_output": 2048
      },
      "status": "active",
      "release_date": "2025-01-01",
      "is_latest": false
    }
  ],
  "updated_at": "2026-01-14T01:40:33.447Z",
  "source": "models.dev"
}
