{
  "$schema": "../schema/model.schema.json",
  "provider": {
    "id": "zhipu",
    "name": "智谱 AI",
    "website": "https://www.zhipuai.cn",
    "api_docs": "https://open.bigmodel.cn/dev/api"
  },
  "models": [
    {
      "id": "glm-4-plus",
      "name": "GLM-4 Plus",
      "family": "glm-4",
      "tier": "max",
      "capabilities": {
        "vision": true,
        "tools": true,
        "streaming": true,
        "json_mode": true,
        "function_calling": true,
        "reasoning": true
      },
      "pricing": {
        "input": 50.0,
        "output": 50.0,
        "currency": "CNY"
      },
      "limits": {
        "context": 128000,
        "max_output": 4096
      },
      "status": "active",
      "release_date": "2024-08-01",
      "is_latest": true,
      "description": "Zhipu flagship model",
      "description_zh": "智谱旗舰模型"
    },
    {
      "id": "glm-4-air",
      "name": "GLM-4 Air",
      "family": "glm-4",
      "tier": "pro",
      "capabilities": {
        "vision": false,
        "tools": true,
        "streaming": true,
        "json_mode": true,
        "function_calling": true,
        "reasoning": false
      },
      "pricing": {
        "input": 1.0,
        "output": 1.0,
        "currency": "CNY"
      },
      "limits": {
        "context": 128000,
        "max_output": 4096
      },
      "status": "active",
      "release_date": "2024-06-01",
      "is_latest": true,
      "description": "Zhipu cost-effective model",
      "description_zh": "智谱高性价比模型"
    },
    {
      "id": "glm-4-flash",
      "name": "GLM-4 Flash",
      "family": "glm-4",
      "tier": "mini",
      "capabilities": {
        "vision": false,
        "tools": true,
        "streaming": true,
        "json_mode": true,
        "function_calling": true,
        "reasoning": false
      },
      "pricing": {
        "input": 0.1,
        "output": 0.1,
        "currency": "CNY"
      },
      "limits": {
        "context": 128000,
        "max_output": 4096
      },
      "status": "active",
      "release_date": "2024-06-01",
      "is_latest": true,
      "description": "Zhipu fast model",
      "description_zh": "智谱快速模型"
    }
  ],
  "updated_at": "2025-01-06T00:00:00Z",
  "source": "manual"
}
