{
  "$schema": "../schema/model.schema.json",
  "provider": {
    "id": "baichuan",
    "name": "百川智能",
    "website": "https://www.baichuan-ai.com",
    "api_docs": "https://platform.baichuan-ai.com/docs/api"
  },
  "models": [
    {
      "id": "Baichuan4",
      "name": "百川 4",
      "family": "baichuan",
      "tier": "max",
      "capabilities": {
        "vision": false,
        "tools": true,
        "streaming": true,
        "json_mode": true,
        "function_calling": true,
        "reasoning": false
      },
      "pricing": {
        "input": 100.0,
        "output": 100.0,
        "currency": "CNY"
      },
      "limits": {
        "context": 32768,
        "max_output": 4096
      },
      "status": "active",
      "release_date": "2024-10-01",
      "is_latest": true,
      "description": "Baichuan flagship model",
      "description_zh": "百川旗舰模型"
    },
    {
      "id": "Baichuan3-Turbo",
      "name": "百川 3 Turbo",
      "family": "baichuan",
      "tier": "pro",
      "capabilities": {
        "vision": false,
        "tools": true,
        "streaming": true,
        "json_mode": true,
        "function_calling": true,
        "reasoning": false
      },
      "pricing": {
        "input": 12.0,
        "output": 12.0,
        "currency": "CNY"
      },
      "limits": {
        "context": 32768,
        "max_output": 4096
      },
      "status": "active",
      "release_date": "2024-06-01",
      "is_latest": true,
      "description": "Baichuan cost-effective model",
      "description_zh": "百川高性价比模型"
    }
  ],
  "updated_at": "2025-01-06T00:00:00Z",
  "source": "manual"
}
